id	text	label
train_000311	nếu xét về tổng quan thì dịch vụ của khách sạn diamond sea cũng tương đối tốt. căn phòng tôi ở được nhân viên dọn dẹp vệ sinh sạch sẽ, tươm tất. vị trí khách sạn thuận tiện, dễ dàng đi lại, tham quan.	1
train_000312	về khách sạn thì tôi đánh giá là tốt. phòng ốc được trang bị đầy đủ tiện nghi, vệ sinh sạch sẽ, nhân viên vui vẻ và các bạn cũng rất nhanh nhẹn và nhiệt tình. vị trí khách sạn thì đối diện biển nên nếu từ phòng nhìn ra biển thì bị khuất. bởi bên kia đường là nhà hàng và khách sạn nên che mất một phần view hướng biển.	1
train_000313	trong chuyến đi vừa qua đến đà nẵng tôi đã chọn lựa dịch vụ của khách sạn diamond sea. tôi cảm thấy hài lòng. vì sự lựa chọn của mình. phòng ốc sạch sẽ, đầy đủ tiện nghi, vệ sinh tốt, nhân viên chuyên nghiệp các bạn làm việc rất tận tâm. chỉ góp ý thêm về chất lượng bánh. trong giỏ mà khách sạn bán. thì tôi thấy chất lượng không tốt lắm. nhưng  tôi vẫn đánh giá cao về dịch vụ mà diamond sea đem lại.	1
train_000314	trong chuyến đi đến đà nẵng vừa qua, tôi đã chọn dịch vụ của khách sạn diamond sea. đánh giá của tôi về khách sạn này là tốt. đúng tiêu chuẩn 4 sao, sang trọng và hiện đại. mọi thứ đều ổn và không có điểm nào đáng chê trách cả.	1
train_000315	khách sạn có vị trí gần biển và dịch vụ chất lượng tốt giá cả phù hợp. đội ngũ nhân viên chuyên nghiệp đã làm vừa lòng khách đến và đi. phòng ốc được trang bị đầy đủ tiện nghi để sử dụng thoải mái. hồ bơi sạch sẽ nữa, nhìn chung cảm thấy hài lòng về dịch vụ này.	1
train_000316	tôi cảm thấy hài lòng khi chọn dịch vụ tại đây. phòng ốc được trang bị đầy đủ tiện nghi, vệ sinh sạch sẽ, nhân viên khách sạn thân thiện và chu đáo. lần sau tôi sẽ quay lại đây khi có dịp.	1
train_000317	nhìn chung dịch vụ của khách sạn diamond sea cũng được. vì bữa sáng chỉ ở mức trung bình. nhưng bù lại thì khách sạn sạch sẽ  tiện nghi. cung cách đón tiếp khách hàng tốt. nhiệt tình và không kém sự vui vẻ.	1
train_000318	cung cách đón tiếp khách hàng thân thiện, lịch sự cộng với căn phòng tiện nghi, sạch sẽ và vị trí thuận tiện đi lại đủ làm tôi cảm thấy hài lòng. trong khoảng thời gian nghỉ ngơi lại khách sạn diamond sea.	1
train_000319	diamond sea là một. trong những khách sạn tốt tại đà nẵng theo nhận xét và đánh giá của tôi. phòng ốc nơi đây được trang bị đầy đủ tiện nghi, vệ sinh sạch sẽ, nhân viên khách sạn thân thiện, nhiệt tình. tôi cảm thấy hài lòng và thoải mái khi ở diamond.	1
train_000320	diamond sea là 1 khách sạn 4 sao. nhưng việc nhân viên không gọi điện thoại cho tôi để hỏi về thời gian tôi đến check in là mấy giờ thì tôi thấy chưa được chu đáo lắm. ngoài bất tiện này ra thì mọi thứ còn lại đều tốt. không gian phòng rộng, mát mẻ. những thiết bị bài trí hiện đại và nội thất nhìn cũng khá sang trọng. lễ tân tiếp đón dễ thương, tác phong chuyên nghiệp. thực đơn đa dạng món, có nhiều sự lựa chọn. nói chung tôi cũng hài lòng về dịch vụ tại đây.	1
train_000321	căn phòng mà tôi ở tại khách sạn diamond sea thì hơi nhỏ. nhưng nhìn chung cũng sạch sẽ và có chất lượng khá ok. về bữa sáng ở khách sạn cũng ổn và tương đối hợp khẩu vị với tôi. tôi không có gì phàn nàn sau khi ở đây cả.	1
train_000322	vị trí đẹp, nhân viên nhiệt tình, nội thất mới tinh hiện đại. an sang cung kha ngon, se quay lai neu co dip khac.	1
train_000323	tôi cảm thấy hài lòng về khách sạn diamond sea ở đà nẵng. phòng ốc thiết kế đẹp, trang trọng và sạch sẽ, nhân viên khách sạn vui vẻ nhiệt tình, vấn đề vệ sinh tốt. không có vấn đề gì khiến tôi phiền lòng khi ở đây cả mà ngược lại rất thoải mái.	1
train_000324	tôi cảm thấy khách sạn diamond sea có vị trí thuận tiện và phòng ốc được thiết kế đẹp. khi tôi ở lại khách sạn thì có để hộ chiếu ở két sắt. trong phòng. khi tôi về thì quên nên đi được một lúc khi quay lại khách sạn hỏi nhân viên thì họ bảo không có. tôi thấy nhân viên làm việc chưa được kĩ lưỡng.	1
train_000325	vừa qua thì tôi có đặt phòng tại khách sạn diamond sea cho chuyến đi đến đà nẵng của mình và tôi thấy khách sạn có chất lượng khá ok. về mọi thứ thì tôi đều hài lòng và không có gì phàn nàn sau khi sử dụng dịch vụ tại đây cả.	1
train_000326	ks ve sinh sach se, vi tri thuan tien cho viec di lai, nhan vien nhiet tinh, chu dao, view dep, gia ca hop ly. thanks mytour.	1
train_000327	với giá cả rất hợp lý mà chất lượng và cách phục vụ rất tốt. tôi hoàn toàn hài lòng khi đến ở khách sạn diamon sea này. phòng ốc ấm cúng và thức ăn cũng khá hợp khẩu vị. tôi thật ấn tượng khi ở đây.	1
train_000328	phòng tôi ở thì không có view gì đẹp. mở cửa ra là thấy tường của nhà khác nên thấy cũng chưa ưng ý lắm. nhưng bù lại thì vệ sinh phòng ở khách sạn diamond sea này cũng khá sạch sẽ và đầy đủ tiện nghi. cách làm việc của nhân viên thì lịch sự, vui vẻ và nhiệt tình. ở đây gần biển nên đi lại thuận tiện, tôi khá hài lòng khi nghỉ tại đây, với giá cả như vậy thì tôi thấy cũng hợp lý, giá cả tương xứng với dịch vụ của khách sạn, cảm ơn mytour đã hỗ trợ tôi đặt phòng nhanh chóng và giá tốt.	1
train_000329	các dịch vụ ở khách sạn diamond sea đều đáp ứng được yêu cầu của tôi, từ dịch vụ phòng ốc, vệ sinh phòng sạch sẽ, các tiện nghi và chất lượng phòng đều ổn. nhân viên thì vui vẻ và nhiệt tình, tôi đánh giá cao dịch vụ ở khách sạn này, với giá cả như vậy thì tôi thấy là hợp lý, không gian xung quanh cũng khá đẹp. tôi hài lòng khi nghỉ tại đây.	1
train_000330	khách sạn diamond sea có dịch vụ tốt, hồ bơi rộng rãi vệ sinh sạch sẽ nước rất. trong xanh. nhân viên phục vụ dễ thương, chủ động xách hộ hành lý cũng như dọn dẹp phòng ngăn nắp. nhưng tôi thấy phòng ốc ở đây thiết kế khá bình thường. chưa đạt chuẩn lắm, nội thất không đẹp.	1
train_000331	vừa qua, tôi có nghỉ tại khách sạn diamond sea khi đến đà nẵng và tôi thấy khá hài lòng khi sử dụng dịch vụ ở đây, phòng ốc ở đây sạch sẽ, gọn gàng, ở cũng thoải mái. mọi thứ ở đây tương đối ổn. nhân viên phục vụ cũng tốt và tôi thấy giá cả như vậy là phù hợp, tương xứng với dịch vụ của khách sạn.	1
train_000332	vừa qua thì tôi có đặt phòng tại khách sạn diamond sea thông qua hệ thống của công ty mytour cho bạn của tôi. khi về tôi có nghe phản ánh lại là bạn tôi rất thích khi ở lại đây nên tôi cũng hài lòng về dịch vụ của mytour và khách sạn cung cấp.	1
train_000333	khách sạn sạch đẹp, gần biển có góc nhìn bao quát. nhân viên thân thiện  dịch vụ tại khách sạn tiện ích.	1
train_000334	vừa qua, tôi có đặt phòng ở khách sạn diamond sea qua hệ thống của mytour và tôi thấy khá hài lòng khi sử dụng dịch vụ ở đây. mọi thứ đều ổn, không có ý kiến và không có phàn nàn gì cả. với giá cả như vậy là tôi thấy hợp lý, phòng ốc ở tốt, tiện nghi có đầy đủ, nhân viên thì lịch sự và vui vẻ, tôi đánh giá khách sạn được điểm 10.	1
train_000335	nằm trên con đường mang tên đại tướng võ nguyên giáp, khách sạn có hướng nhìn ra biển rất đẹp và không gian cũng thoáng mát. nhân viên rất tận tình, phục vụ khá chu đáo với khách hàng. mặt khác, tại đây khá gần các khu nhà hàng ăn uống, chỉ cần đi bộ vài phút thôi mà đã có rất nhiều nhà hàng với đủ loại món ăn để tôi lựa chọn. không những vậy. phòng ốc ở đây cũng rất mới, nội thất trang trí thì đẹp. nếu có lần sau tôi sẽ quay lại.	1
train_000336	nhìn chung , thì tôi thấy dịch vụ ở đây khá tốt. không có gì để phàn nàn cả. nhân viên thì cũng lịch sự, vui vẻ và niềm nở với khách. phòng ốc ở đây thì cũng sạch sẽ và đầy đủ tiện nghi. ở vị trí này cũng rất đẹp, gần ngay biển nên cảnh quang xung quanh thoáng mát, đi lại cũng rất thuận tiện, giá cả như vậy thì tôi hấy cũng rất hợp lý, tôi cảm thấy khá hài lòng khi nghỉ tại đây.	1
train_000337	khách sạn diamond sea có vị trí đẹp gần biển, phòng ốc rộng rãi và được trang bị nội thất hiện đại sử dụng rất thích. thái độ phục vụ cũng rất chuyên nghiệp đã đáp ứng tất cả mọi nhu cầu của chúng tôi. cảm thấy ấn tượng và hài lòng khi đã chọn dịch vụ này. sẽ quay trở lại nếu có dịp.	1
train_000338	vừa qua tôi đã sử dụng dịch vụ của khách sạn này và cảm thấy khá ok. tôi ở phòng deluxe. tuy không được to lắm. nhưng cũng đầy đủ tiện nghi  vệ sinh sạch sẽ  thoáng mát  nhân viên phục vụ chu đáo  nhiệt tình. tôi cảm thấy hài lòng khi ở đây.	1
train_000339	phòng ốc ở khách sạn rất sạch sẽ, thoải mái với đầy đủ các trang thiết bị tiện nghi. nhân viên thân thiện, nhiệt tình và chu đáo. thêm vào đó thì bữa ăn sáng ở đây khá là ngon. vị trí của khách sạn lại rất thuận tiện cho chuyến đi du lịch của tôi.	1
train_000340	khách sạn dimond sea có chất lượng và dịch vụ tốt, nhân viên chu đáo, nhiệt tình, phòng ốc rộng rãi, thoáng mát, sạch sẽ, tiện nghi cũng khá đầy đủ, phù hợp với nhu cầu sử dụng của khách hàng. ngoài ra  tôi cũng có sử dụng bữa ăn sáng ở đây thì thấy cũng ok  hồ bơi sạch sẽ. nhưng giá như có thể rộng hơn nữa thì hay hơn. tôi có chuyến đi vui và khá hài lòng về nơi đây, có cơ hội tôi sẽ quay lại lần nữa.	1
train_000341	tôi cảm thấy hài lòng khi ở lại khách sạn diamond sea. diên tích phòng ở rộng rãi, trang trí hài hoà, thiết kế hiện đại, view hướng biển rất đẹp và thoáng mát. tiện nghi đầy đủ phù hợp nhu cầu sử dụng.	1
train_000342	khách sạn diamond sea có vị trí gần biển nên đi lại thuận lợi. nhân viên chu đáo, nhiệt tình. phòng ốc sạch sẽ, đầy đủ tiện nghi. tôi thấy dịch vụ ở khách sạn này tốt. tương xứng với giá cả. tôi hài lòng khi lựa chọn khách sạn này là nơi nghỉ ngơi khi đi du lịch đà nẵng.	1
train_000343	tôi ở diamond sea và thấy ấn tượng về phong cách phục vụ của nhân viên, chuyên nghiệp và lịch sự. phòng thì thoáng và rộng, ở cảm thấy thoải mái. không có điều gì phàn nàn về khách sạn cả. dịch vụ xứng đáng với giá tiền mà tôi đã bỏ ra.	1
train_000344	khách sạn còn khá mới nên nhân viên còn thiếu kinh nghiệm. nhưng bù lại được cái nhiệt tình. diện tích phòng rộng, gòn gàng, sạch sẽ, dễ chịu khi ở. vị trí gần trung tâm thuận tiện đi lại. tôi thấy hài lòng khi ở lại khách sạn này.	1
train_000345	nhìn chung kỳ này này của gia đình chúng tôi thành công và thật vui vẻ với dịch vụ khách diamond sea đã đáp ứng đầy đủ nhu cầu của chúng tôi. thức ăn sáng ở đây cũng khá tuyệt. tiện nghi được trang bị đầy đủ không thiếu món gì cả. vệ sinh sạch sẽ thoáng mát bên cạnh đội ngũ phục vụ nhiệt tình vui vẻ thì tôi thấy diamond sea xứng đáng là khách sạn 4 sao. cám ơn mytour đã cung cấp dịch vụ này đến chúng tôi.	1
train_000346	khách sạn có cái bể bơi hơi bé. phòng thì cũng không được rộng rãi lắm. nhưng được cái sạch sẽ  gọn gàng và đầy đủ các vật dụng và thiết bị cần thiết. nhân viên ở đây có thái độ nhẹ nhàng, vui vẻ và hướng dẫn khách hàng rất nhiệt tình. bửa ăn sáng tại khách sạn cũng ngon.	1
train_000347	tôi ở khách sạn diamond sea thấy rất thích. phòng rất đẹp, an ninh và sạch sẽ. nhưng tiếc cái là tôi đặt có 1 ngày  định ở lại thêm 2 3 đêm nửa nhưng khách sạn hết phòng và tôi phải chuyển khách sạn khác. nói chung rất tuyệt vời.	1
train_000348	phải nói khách sạn diamond sea được thiết kế khá đẹp. khách sạn ở trên cao nên có thể ngắm được toàn cảnh thành phố đà nẵng, đẹp nhất là về đêm. dịch vụ của khách sạn khá hay. phòng ở rộng rãi , thoải mái.	1
train_000349	tôi cảm thấy rất hài lòng về khách sạn này. phòng được vệ sinh tốt, thiết kế sang trọng mà trang nhã. đồ đạc tiện nghi khá đầy đủ. vị trí khách sạn rất thuận lợi cho tôi đi công tác ở. trong thành phố.	1
train_000350	so với số tiền đã bỏ ra thì theo tôi cảm nhận chất lượng tại khách sạn gold đà nẵng đáp ứng đầy đủ và khá tốt. mọi dịch vụ đều rất ổn từ đội ngũ nhân viên thân thiện, nhiệt tình, phòng ốc sạch sẽ, tiện nghi đi kèm tốt cũng như vị trí thuận tiện và giá cả hợp lý. nhìn chung thì tôi hài lòng về nơi này.	1
train_000351	khách sạn gold đà nẵng có vị trí hơi xa biển. chất lượng phòng ở được giữ gìn vệ sinh sạch sẽ. trang thiết bị, nội thất cần thiết đầy đủ. khâu vệ sinh được chú ý sạch sẽ. nhân viên phục vụ khách hàng khá tốt.	1
train_000352	ngoại trừ hơi ồn ra thì những mặt khác khách sạn cung cấp tốt. những bạn nhân viên phục vụ khách hàng vui vẻ, nhiệt tình. phòng ở được giữ gìn vệ sinh sạch sẽ. trang thiết bị, tiện nghi cần thiết được cung cấp đầy đủ.	1
train_000353	ưu điểm lớn nhất ở khách sạn gold đà nẵng này là sự nhiệt tình, hiếu khách của mọi người. bên cạnh đó, vệ sinh phòng sạch, không gian thông thoáng. cùng với bữa sáng tương đối ổn nên tôi thấy hài lòng.	1
train_000354	cảm nhận của tôi về chất lượng khách sạn gold đà nẵng là khá ổn. trong suốt thời gian nghỉ ngơi cùng người thân tại đây. mọi dịch vụ đáp ứng được nhu cầu của mọi người từ nhân viên phục vụ, vấn đề vệ sinh đến tiện nghi phòng ốc, giá cả cũng như vị trí tọa lạc. tôi không có ý kiến gì phàn nàn về nơi này.	1
train_000355	thông qua mytour tôi có đặt phòng tại khách sạn gold đà nẵng làm diểm dừng chân cho cả nhà. sau khi ở đây tôi rất hài lòng về mọi dịch vụ mà khách sạn cung cấp từ phòng ốc, nhân viên, vệ sinh tiện nghi đến giá cả, dịch vụ đi kèm khác cũng như vị trí và view xung quanh. nhìn chung mọi thứ đều tốt và tôi không phàn nàn gì về nơi này.	1
train_000356	khách sạn gold đà nẵng nằm ngay vị trí trung tâm nên thuận tiện cho việc đi lại của tôi. phòng ốc sạch sẽ, trang thiết bị cũng như cơ sở vật chất được trang bị đầy đủ tiện nghi. tôi sẽ trở lại đây nếu có dịp.	1
train_000357	vị trí khách sạn phù hợp với yêu cầu đi lại của tôi. chất lượng dịch vụ tốt khiến tôi hài lòng. nhân viên họ vui vẻ, nhiệt tình với khách hàng. trang thiết bị, nội thất cần thiết đầy đủ. khâu vệ sinh được chú ý sạch sẽ.	1
train_000358	chất lượng so với  chi phí đã bỏ ra thì tôi cũng hài lòng. những bạn nhân viên có thái độ phục vụ khách hàng khá tốt. cơ sở vật chất, trang thiết bị cơ bản đầy đủ. phòng ốc được chú ý giữ gìn vệ sinh sạch sẽ.	1
train_000359	phòng ốc được dọn dẹp vệ sinh sạch sẽ, tiện nghi đầy đủ, nhân viên phục vụ cũng nhiệt tình, thân thiện. nhìn chung, tôi đánh giá khách sạn gold đà nẵng có chất lượng tốt. tôi sẽ trở lại đây nếu có dịp.	1
train_000360	trong chuyến du lịch vừa qua tôi có đặt phòng tại khách sạn gold đà nẵng làm nơi dừng chân và sau khi ở đây tôi có vài nhận xét sau. nhìn chung mọi thứ tại đây đều tốt hết từ vị trí, nhân viên đến vệ sinh phòng ốc, giá cả cũng như các dịch vụ đi kèm. tôi không có gì để phàn nàn.	1
train_000361	lễ tân nhiệt tình, được in sớm khi có sẵn phòng trống. phục vụ chu đáo.	1
train_000362	phòng ốc tại khách sạn này sạch sẽ, khang trang, trang thiết bị đầy đủ tiện nghi, thái độ đón tiếp và phục vụ ân cần, chu đáo. cảm thấy rất hài lòng và ấn tượng về dịch vụ cũng như chuyến đi đà nẵng này.	1
train_000363	sau thời gian trải nghiệm dịch vụ về. tôi không nghe người quen của tôi chê trách gì về chất lượng.	1
train_000364	do phòng ốc đúng mong đợi, ở thoải mái, phòng đầy đủ tiện nghi hữu ích mà cũng sạch nữa.	1
train_000365	vừa qua, tôi có nghỉ tại khách sạn gold đà nẵng, ở đây thì nhân viên hỗ trợ cũng vui vẻ, nhiệt tình. về dịch vụ chung cơ bản là ổn. không có gì phàn nàn. vệ sinh sạch sẽ, gọn gàng, tiện nghi có đầy đủ, dịch vụ chung tương xứng với giá và đáp ứng được yêu cầu của khách , tôi hài lòng khi nghỉ tại đây.	1
train_000366	khách sạn nằm khu vực trung tâm, vệ sinh sạch sẽ, lễ tân lịch sự và nhiệt tinh. giá tốt.	1
train_000367	tuy thời gian nghỉ ngơi lại khách sạn gold đà nẵng không lâu lắm nhưng nhìn chung dịch vụ ok lắm. căn phòng được nhân viên dọn dẹp vệ sinh kỹ càng, đồ đạc ngăn nắp. thái độ phục vụ khách hàng lịch sự.	1
train_000368	dịch vụ khách sạn gold đà nẵng ok, phòng ốc sạch sẽ, tiện nghi thiết thực. thái độ phục vụ cũng không có gì phàn nàn. chỉ có 1 điểm trừ duy nhất là tôi ở đây mấy ngày. nhưng không có sự thay đổi món ăn sáng.	1
train_000369	theo cảm nhận khách quan của riêng cá nhân tôi sau khoảng thời gian trải nghiệm dịch vụ của khách sạn gold đà nẵng thì chất lượng dịch vụ của khách sạn tốt. địa thế toạ lạc thuận tiện. vì gần nhiều địa điểm ăn uống và cũng dễ dàng đi lại nữa. đồng thời, căn phòng tôi ở đáp ứng được các tiêu chí cần thiết về sự tiện nghi cũng như sự sạch sẽ. thái độ phục vụ khách hàng vui vẻ và không kém phần thân thiện.	1
train_000370	khách sạn gold đà nẵng sạch sẽ, địa điểm toạ lạc thuận tiện đi lại. thêm vào đó, nhân viên lịch sự khi tiếp đón du khách nên khi nghỉ ngơi lại đây tôi cảm thấy thoải mái và không có gì phàn nàn nữa cả.	1
train_000371	khách sạn ở vị trí trung tâm, phòng sạch đẹp. giá cả phải chăng. nhân viên mytour tư vấn rất nhiệt tình.	1
train_000372	khách sạn gold  đà nẵng tọa lạc tại vị trí tương đối trung tâm, chỉ cần đi xe hơn 5 phút đã ra đến cầu sông hàn cũng như các khu mua sắm và ăn uống. ngoài ra khách sạn cũng khá sạch sẽ, phòng nhìn sáng sủa, các thiết bị. trong phòng đều hoạt động tốt. nhân viên dễ thương, đón tiếp nhiệt tình.	1
train_000373	khách sạn tốt, view đẹp và gần sân bay.	1
train_000374	nếu xét theo mức giá thì tôi hoàn toàn hài lòng về dịch vụ của khách sạn. nhân viên đón tiếp vui vẻ, trò chuyện cởi mở còn phòng ốc thì rộng rãi, sạch sẽ. những thiết bị lắp đặt bên. trong phòng hoạt động tốt, bộ vật dụng cá nhân đầy đủ và sạch sẽ. vị trí tương đối gần biển, thuận tiện cho chuyến du lịch của tôi.	1
train_000375	tôi rất hài lòng với dịch vụ khách sạn gold đà nẵng, đúng với mức giá tôi đã trả và nhân viên thì lịch sự, đón tiếp tử tế. phòng được dọn dẹp tươm tất, tiện nghi cơ bản đầy đủ và vật dụng cá nhân thì mới mẻ. vị trí ổn, cũng không quá khó khăn. trong việc đi lại.	1
train_000376	khách sạn gold đà nẵng nằm gần cầu sông hàn nên rất thuận lợi, dễ dàng cho việc đi lại. bên cạnh đó, chất lượng phòng ốc tốt, đẹp, tôi thấy ưng ý. thời gian nghỉ ngơi lại đây tôi thấy hài lòng về khách sạn.	1
train_000377	khách sạn gold đà nẵng nói chung là cũng được, phòng hơi bé và bí. nhưng bù lại nhân viên dọn dẹp kĩ  tiện nghi cơ bản trang bị đầy đủ. ngoài ra nhân viên ở đây có thái độ khá tốt  họ tiếp đón tôi nhiệt tình  niềm nở. mức giá ổn, phù hợp với nhiều đối tượng.	1
train_000378	nhân viên vui vẻ, nhiệt tình. phòng ở tốt, đầy đủ tiện nghi, khang trang. điểm 8 là số điểm mà tôi dành cho khách sạn.	1
train_000379	tôi đánh giá tốt dịch vụ ở khách sạn gold đà nẵng này, dịch vụ phòng rất ok, phòng tôi ở thì sạch sẽ, đạt yêu cầu. với mức giá tôi bỏ ra như vậy là tôi thấy phù hợp với dịch vụ khách sạn. cách làm việc của nhân viên cũng nhanh chóng, vui vẻ. mọi thứ đều ổn, không có gì phàn nàn, vị trí đi lại cũng thuận tiện. tôi hài lòng khi nghỉ tại đây.	1
train_000380	mytour đã giúp tôi đặt phòng tại khách sạn gold đà nẵng nhanh chóng, thao tác thì dễ dàng. theo tôi nhận xét thì chất lượng phòng ở đây ok, tiện nghi được trang bị đầy đủ nhân viên tiếp đón cũng. vậy, luôn mỉm cười với khách. tuy nhiên điểm trừ của khách sạn là vị trí hơi xa biển. chưa thuận tiện lắm.	1
train_000381	theo ý kiến đánh giá khách quan của tôi thì khách sạn gold đà nẵng có chất lượng phòng ốc khá tốt nên tôi cảm thấy hài lòng sau khi sử dụng dịch vụ tại đây. nếu dựa trên thang điểm 10 thì tôi có thể cho khách sạn khoảng 9 điểm.	1
train_000382	trong chuyến đi vừa qua thì tôi có lựa chọn khách sạn gold đà nẵng làm điểm lưu trú. nhìn chung thì tôi cũng cảm thấy hài lòng sau khi sử dụng dịch vụ tại đây. buffet ở khách sạn bắt đầu khá sớm tầm khoảng 6g hơn nên khi hơn 7g tôi xuống thì gần hết đồ ăn rồi.	1
train_000383	với số tiền tôi đã chi ra thì chất lượng dịch vụ của gold đà nẵng là tương xứng. hầu như mọi yêu cầu của tôi đều được đáp ứng, căn phòng khiến tôi cảm thấy ưng ý. phòng được dọn dẹp tỉ mỉ, nhìn sạch và đồ đạc cũng ngăn nắp. thái độ nhân viên phục vụ thì nhiệt tình, lễ tân vui vẻ. nói chung đây là một quyết định đúng.	1
train_000384	chỉ theo cảm nhận của riêng cá nhân tôi thì tôi rất thích khách sạn gold đà nẵng. vị trí gần biển, đi lại thuận lợi. thực đơn sáng chế biến ngon và đa dạng món. nhân viên chủ động dọn phòng hằng ngày, thái độ làm việc rất cẩn thận. cơ sở vật chất tốt, các thiết bị bố trí đầy đủ.	1
train_000385	khách sạn gold là một. trong những sự lựa chọn của tôi khi tôi đến đà nẵng. phòng ốc nơi đây được trang bị đầy đủ đồ dùng, nhân viên khách sạn vui vẻ, nhiệt tình, tác phong làm việc nhanh nhạy. vị trí khách sạn khá xa trung tâm nên việc muốn đi dạo chơi cũng hơi bất tiện.	1
