id	text	label
train_000632	khách sạn này có chất lượng tốt. phòng ốc được dọn dẹp vệ sinh sạch sẽ. trang thiết bị, nội thất được khách sạn cung cấp đầy đủ. các bạn nhân viên khách sạn họ có thái độ phục vụ khách hàng vui vẻ, nhiệt tình.	1
train_000633	tôi hài lòng với chi phí đã bỏ ra để đặt phòng tại khách sạn này. đội ngũ nhân viên có thái độ tốt, nhiệt tình, chu đáo với khách hàng. phòng ở vệ sinh sạch sẽ. tiện nghi, nội thất được khách sạn trang bị đầy đủ.	1
train_000634	khách sạn nirvana theo đánh giá của tôi có chất lượng dịch vụ tốt. phòng ốc được dọn dẹp vệ sinh sạch sẽ. trang thiết bị, tiện  nghi cơ bản khách sạn cung cấp đầy đủ. những bạn nhân viên có thái độ phục vụ nhiệt tình.	1
train_000635	thái độ đón tiếp của nhân viên thì ok. mọi thứ ở like backpacker hostel đà nẵng đều sạch sẽ. tuy nhiên  tôi đặt căn phòng female nhưng họ lại bố trí tôi ở căn phòng khác. tôi có nói với họ thì họ nói mai sẽ đổi. nhưng cuối cùng vẫn không đổi.	1
train_000636	nghỉ lại khách sạn này tôi thấy hài lòng, phòng được dọn dẹp gọn gàng và những tiện nghi cơ bản cũng bố trí đầy đủ. đặc biệt tôi luôn có cảm giác ấm áp khi ngủ. trong căn phòng của mình. nhân viên có thái độ thân thiện, tiếp đón khách niềm nở. giá khách sạn rẻ, phù hợp với những cá nhân như tôi. vị trí ổn, đi lại thuận tiện.	1
train_000637	like backpacker hostel đà nẵng này có 1 điểm trừ duy nhất là cả 3 ngày tôi ở đây đều phục vụ bữa sáng là bánh mì trứng nên mọi người cảm thấy ngán. nếu nhà nghỉ có thể thay đổi món ăn mỗi ngày sẽ hoàn thiện dịch vụ hơn. vì mọi thứ ở đây đều tốt, căn phòng tôi ở có không gian thoáng mát, dọn phòng kỹ càng, tươm tất. nhân viên nhiệt tình với khách hàng nên tôi thấy hài lòng khi nghỉ ngơi lại nơi đây.	1
train_000638	vừa qua, tôi có nghỉ tại like backpacker hostel đà nẵng. tôi không sử dụng dịch vụ ở đây nhiều. nên cũng không thể đánh giá được nhiều. nhưng nhìn chung  thì phòng ốc ở đây cũng đạt tiêu chuẩn  vệ sinh phòng sạch sẽ  tiện nghi đầy đủ. nhân viên lịch sự, vui vẻ. tôi hài lòng khi nghỉ tại đây. dịch vụ không có gì phàn nàn cả.	1
train_000639	tôi ở căn phòng like 10 bed mixed dorm và căn phòng này được dọn dẹp rất sạch sẽ.	1
train_000640	so sánh với mức tiền tôi đã chi trả thì chất lượng dịch vụ ở khách sạn nirvana này tương xứng. tôi cảm thấy thoải mái khi chọn nơi này làm điểm nghỉ ngơi. không gian phòng ở không những thoáng mát mà còn sạch sẽ.	1
train_000641	khách sạn này có vị trí tốt, gần biển. giá cả như vậy ổn, tương xứng với chất lượng. chỉ nghỉ có một đêm nên cũng không đánh giá được gì nhiều. phòng ở ổn, vệ sinh sạch sẽ. trang thiết bị, tiện nghi cơ bản đầy đủ.	1
train_000642	theo cảm nhận khách quan của riêng cá nhân tôi sau khoảng thời gian nghỉ ngơi lại like backpacker hostel đà nẵng này thì chất lượng dịch vụ ok. phòng ốc sạch sẽ, thoáng mát nên tôi cũng cảm thấy thoải mái khi ở.	1
train_000643	nhìn chung, phòng ốc ở đây thoải mái, không gian thông thoáng, sạch sẽ.	1
train_000644	tôi rất hài lòng khi chọn khách sạn nirvana để nghỉ ngơi. khách sạn có những dịch vụ tốt lắm. nhân viên chuyên nghiệp, nhiệt tình với khách hàng. vệ sinh sạch sẽ. cơ sở vật chất, tiện nghi khách sạn trang bị đầy đủ.	1
train_000645	với chi phí đã bỏ ra tôi nhận thấy phù hợp với chất lượng dịch vụ. vị trí thuận tiện, phù hợp với yêu cầu đi lại của tôi. phòng ở có chất lượng khá là ok. vệ sinh sạch sẽ. tiện nghi, cơ sở vật chất khách sạn trang bị đầy đủ.	1
train_000646	ngày 17 02 2016, tôi đã có 1 nghỉ 1 đêm tại ks, tôi nhận phòng lúc 12h đêm. dù rất trễ. nhưng nhân viên rất nhiệt tình  thân thiện. phòng rất gọn gàng, sạch sẽ, giá cả phù hợp, vị trí gần sân bay, rất thuận lợi cho những chuyến bay đêm của tôi. chắc chắn những chuyến bay sau tôi vẫn sẽ chọn ks làm chỗ dừng chân.	1
train_000647	tôi rất hài lòng về dịch vụ này. tuy chỉ 1 sao mà chất lượng phù hợp với giá cả. phòng ốc sạch sẽ có những tiện nghi cơ bản để sử dụng. thái độ đón tiếp ân cần nên tạo được ấn tượng. trong tôi về dịch vụ này.	1
train_000648	tôi rất thích và cảm thấy ấn tượng với khách sạn like backpacker hostel đà nẵng. phong cách thiết kế độc đáo. tuy nhìn không được sang trọng nhưng rất hiện đại và gọn gàng. nhân viên phục vụ vui vẻ, thân thiện tiếp đón khách. diện tích phòng không lớn lắm. nhưng nội thất bố trí hợp lý  đầy đủ tiện nghi cho tôi sử dụng.	1
train_000649	theo đánh giá của cá nhân tôi khách sạn này đang cung cấp những dịch vụ tôi nhận thấy tốt. vị trí phù hợp với yêu cầu đi lại của tôi. phòng ốc được giữ vệ sinh sạch sẽ. tiện nghi, nội thất trong phòng khách sạn cung cấp đầy đủ.	1
train_000650	phòng ốc sạch sẽ, tiếp tân niềm nở.	1
train_000651	khách sạn này tốt tôi đã đặt đến lần hai rồi. chất lượng dịch vụ ok lắm. phòng ốc được giữ vệ sinh sạch sẽ, trang thiết bị cơ bản khách sạn bố trí đầy đủ và còn nhân viên khách sạn rất nhiệt tình với khách hàng.	1
train_000652	nhân viên phục vụ thân thiện và không kém phần lịch sự. trong cách ứng xử, giao tiếp với khách hàng. dịch vụ phòng ở được chuẩn bị khá chu đáo, dọn phòng tươm tất, gọn gàng. nói chung, tôi thấy khách sạn tốt.	1
train_000653	trong chuyến đi vừa qua thì tôi có lựa chọn like backpacker hostel đà nẵng làm nơi lưu trú. tôi cảm thấy rất hài lòng về khách sạn này. vì thiết kế khá độc đáo cùng với giá cả khá rẻ. tôi có thể cho khách sạn này khoảng được 8 điểm.	1
train_000654	khách sạn có thiết kế độc đáo, mới lạ, phòng ốc thì sạch sẽ. trong phòng cũng tiện nghi không thiếu gì cả. nhân viên dễ thương, nhiệt tình chào đón tôi mà hướng dẫn cũng khá tỉ mỉ. vị trí khách sạn đi lại cũng rất dễ dàng, đi ăn hay mua sắm gì cũng gần. tôi rất hài lòng và sẽ quay lại.	1
train_000655	căn phòng mà tôi lưu trú lại like backpacker hostel đà nẵng rất rộng rãi và thông thoáng tạo cho tôi cảm giác thoải mái khi ở đây. về cung cách phục vụ của nhân viên cũng ok, nhiệt tình tiếp đón khách hàng.	1
train_000656	đúng như cái tên không gian của khách sạn  like backpacker hostel đà nẵng khá lạ và độc đáo. phòng ốc mới, sạch đẹp và đầy đủ tiện nghi. nhân viên phục vụ khách sạn nhiệt tình, niềm nở làm cho tôi có cảm giác như ở nhà. nếu như có cơ hội lần sau, tôi sẽ quay lại và ủng hộ khách sạn.	1
train_000657	đây là một khách sạn tuyệt vời, vị trí tót, sạch sẽ, yên tĩnh, gần trạm xe bus và nhân viên rất thân thiện. đối diện khách sạn còn có một công viên rất đẹp, rất thích hợp tản bộ sáng sớm hay chiều tà.	1
train_000658	hài lòng với khách sạn này, sẽ thuê lại nếu có dịp.	1
train_000659	khách sạn rộng rãi. vị trí rất thuận tiện. nhân viên thân thiện. có pickup   dropoff sân bay.	1
train_000660	nhân viên chuẩn bị phòng ốc khá tươm tất, sạch sẽ. địa điểm toạ lạc thuận tiện đi lại tham quan, ăn uống.	1
train_000661	dịch vụ ở khách sạn whale đà nẵng tốt. phòng ở tôi thấy cũng đạt tiêu chuẩn, sạch sẽ, ở cũng thoải mái. nhân viên thì vui vẻ và lịch sự. giá cả như vậy thì tôi thấy không có ý kiến gì. tôi hài lòng khi nghỉ tại đây.	1
train_000662	tôi có chọn phòng tại khách sạn whale đà nẵng cho gia đình mình đi nghỉ dưỡng. trong chuyến du lịch vừa qua và sau khi về tôi có vài nhận xét sau. dịch vụ đều ổn hết từ tiện nghi, vệ sinh phòng ốc đến nhân viên cũng như giá cả, vị trí gần biển nên thuận tiện cho việc tắm biển và đi dạo.	1
train_000663	vì dịch vụ khách sạn tốt nên tôi mới quay lại. cách thiết kế nội thất khang trang, tiện nghi đầy đủ. địa thế thuận tiện, đi lại ăn uống hay tham quan đều dễ dàng. thái độ nhân viên niềm nở, luôn tươi cười.	1
train_000664	tôi không phàn nàn gì về mọi thứ ở khách sạn louis này. khách sạn này có chất lượng phòng ốc khá ok, nhân viên phục vụ niềm nở, thân thiện, vị trí đi lại thuận tiện. tôi sẽ trở lại đây nếu có dịp.	1
train_000665	được xây dựng tại vị trí thuận tiện, phù hợp với yêu cầu đi lại của tôi. hơn nữa những dịch vụ khách sạn đang cung cấp có chất lượng ổn. nhân viên phục vụ khách hàng ok. phòng ở vệ sinh sạch sẽ. tiện nghi đầy đủ.	1
train_000666	tôi rất thích khách sạn louis, vị trí ngay trung tâm, khách sạn đúng với tiêu chuẩn 3*, nhân viên phục vụ thân thiện, cởi mở, ăn sáng rất ngon, hợp khẩu vị. phòng ốc gọn gàng sạch sẽ, rất vừa ý, giá cả rất phù hợp với tiêu chuẩn 3*, có dịp quay lại đà nẵng tôi sẽ tiếp tục chọn louis.	1
train_000667	khách sạn ngay trung ta6mm dịch vụ tốt.	1
train_000668	phòng ốc sạch sẽ tiện nghi trong phòng cũng được trang bị đầy đủ, nhân viên khách sạn vui vẻ và hòa đồng. nhưng làm việc cũng rất nhanh nhẹn.	1
train_000669	khách sạn louis mang cho tôi cảm giác thoải mái khi nghỉ lại. đội ngũ nhân viên thân thiện, gần gũi. phòng thiết kế đẹp, ấm cúng và vệ sinh sạch sẽ. địa điểm ở đây dễ dàng tìm kiếm, đi đâu cũng thuận tiện. vì không xa trung tâm lắm. tôi chấm điểm 9 cho chất lượng dịch vụ.	1
train_000670	khách sạn hadana boutique đà nẵng đang có chất lượng tốt ví như các bạn nhân viên có cung cách phục vụ khách hàng ổn, trang thiết bị, nội thất cần thiết đầy đủ. khâu vệ sinh được khách sạn chú ý khá là sạch sẽ.	1
train_000671	tôi đến khách sạn hadana boutique lúc 12 giờ. nhưng phải chờ đúng giờ quy định thì lễ tân mới làm thủ tục check in cho khách. ngoài vấn đề đó ra thì phòng ốc tốt, tiện nghi đầy đủ, vệ sinh sạch sẽ. phong cách phục vụ nhiệt tình và vui vẻ.	1
train_000672	chuyến công tác vừa qua tôi chọn dịch vụ này để nghỉ lại và thấy phòng ốc khang trang rộng rãi và thoải mái. tôi được phục vụ bữa ăn sáng miễn phí và thấy ngon miệng. nhìn chung chất lượng dịch vụ ở đây không có điều gì để phàn nàn cả.	1
train_000673	điểm duy nhất mà tôi không được vừa ý khi ở tại khách sạn louis là bữa sáng không được ngon và cũng chưa thật sự phong phú. về phòng ốc thì khá được. vì sạch sẽ và khá đủ trang thiết bị nội thất phù hợp cho nhu cầu sử dụng của tôi.	1
train_000674	vừa qua tôi có chuyến đi công tác tại đà nẵng và có đặt phòng tại khách sạn louis thông qua hệ thống của mytour. vị trí của khách sạn rất thuận tiện cho chuyến đi công tác của tôi và cũng rất gần trung tâm. phòng ốc thì thoải mái, sạch sẽ. nhân viên chu đáo, nhiệt tình và vui vẻ.	1
train_000675	phòng khách sạn louis đà nẵng đẹp, tiện nghi đầy đủ và bố trí hợp lý. ăn sáng không nhiều món. nhưng cũng khá ngon miệng. giá tiền phòng như khách sạn louis đà nẵng là tương đối hợp lý với chất lượng. nhân viên nhiệt tình, thân thiện. tôi hài lòng khi ở đây.	1
train_000676	kiến trúc của khách sạn rất độc đáo, sang trọng. phòng ngủ được trang trí đẹp với các thiết bị hiện đại. nhân viên chuyên nghiệm và nhiệt tình. tôi thấy giá tiền như vậy với chất lượng là hợp lí.	1
train_000677	khách sạn khách sạn louis, đà nẵng là còn khá mới, phòng ốc đẹp. cơ sở vật chất của khách sạn đầy đủ. nhân viên lịch sự, vui vẻ. so với giá cả và chất lượng như vậy thì tôi thấy phù hợp để ở.	1
train_000678	khách sạn có chất lượng tuyệt vời. từ đây đi ra sông hàn cũng không xa và có thể đi bộ các quán cà phê. các quán ăn ngon ở gần đây. nhân viên thân thiện và luôn chào hỏi khách. các bữa ăn sáng ngon.	1
train_000679	tôi chỉ đặt giúp cho khách đoàn. tuy nhiên theo phản hồi của khách tôi thấy dịch vụ ở đó tốt  thuận tiện cho khách đi lại. khách rất hài lòng và khen ngợi dịch vụ ở đó.	1
train_000680	theo cá nhân tôi thấy thì dịch vụ ở khách sạn eden plaza đà nẵng không có gì phải phàn nàn cả. mọi thứ cơ bản là khá tốt. phòng ốc được vệ sinh sạch sẽ, đầy đủ tiện nghi. nhân viên phục vụ cũng thân thiện, nhiệt tình. mọi thứ ổn, tôi hài lòng khi nghỉ tại đây.	1
train_000681	với tiêu chuẩn 4 sao, dịch vụ của khách sạn eden plaza đà nẵng đã khiến tôi thấy rất hài lòng, chi phí bỏ ra là xứng đáng. phòng gym, khu vực ăn uống cũng như hồ bơi của khách sạn khá rộng rãi, sạch sẽ. căn phòng của tôi cũng thế, đẹp và mới, nhân viên làm việc tốt. mỗi tội khách sạn này tọa lạ hơi xa trung tâm thành phố, đi lại còn bất tiện.	1
train_000682	tôi rất hài lòng khi ở khách sạn này, giá cả khá hợp lý với gia đình tôi, nhân viên thân thiện và dịch vụ tốt.	1
train_000683	đây là một địa điểm phù hợp với thu nhập của hầu hết mọi người. thái độ phục vụ niềm nở, ân cần và rất nhiệt tình. phong cách phòng ngủ cổ điển giúp chúng ta hồi tưởng về ngày xưa. địa điểm phù hợp với các điểm du lich cũng như khi xuống và ra sân bay. tuy nhiên  các món điểm tâm buổi sáng hơi đơn điệu. chưa có các món đặc sản của đà nẵng cho du khách thưởng thức. vd: mỳ quảng, ..	1
train_000684	một khách sạn ấn tượng, chúng tôi đã có 1 kỳ nghỉ tuyệt vời. khách sạn và nhân viên phục vụ rất tốt.sau một ngày đi chơi các thắng cảnh của đà nẵng và ăn các đặc sản của đà nẵng, quay về khách sạn ngủ.. trải nghiệm một cảm giác thật tuyệt.nếu có lần sau quay lại, tôi sẽ vẫn chọn khách sạn này.	1
train_000685	nhân viên thân thiện, chu đáo và nhiệt tình khi chúng tôi nhờ giúp đỡ. phòng đẹp, tiện nghi. từ khách sạn đi ra các trung tâm thành phố, gần big c, gần chợ nên chúng tôi có thể lượn vòng tất cả các địa điểm mà không tốn nhiều thời gian cho lắm.	1
train_000686	căn phòng ban đầu tôi nhận thì bị trục trặc về máy điều hoà. tôi có báo nhân viên từ lúc 12 giờ. nhưng đến tầm 16 giờ hơn thì họ mới sắp xếp đổi phòng cho tôi được. còn về thái độ phục vụ thì lịch sự rồi.	1
train_000687	tôi có nghỉ tại khách sạn eden plaza đà nẵng và tôi thấy dịch vụ ở đây khá ok. mọi thứ đều tốt, không có gì phàn nàn cả, từ vệ sinh phòng sạch sẽ. đầy đủ tiện nghi đến cách làm việc của nhân viên cũng rất ok, lịch sự, vui vẻ. với mức giá cả như vậy thì tôi thấy hợp lý, giá cả tương xứng với dịch vụ của khách sạn. vị trí cũng thuận tiện cho việc đi lại của tôi.	1
train_000688	về tổng quan thì dịch vụ ở khách sạn eden plaza đà nẵng này tốt. vệ sinh phòng ốc sạch sẽ, tiện nghi. tuy nhiên khi gọi nhân viên lên hướng dẫn sử dụng két sắt thì không có ai cả. mỗi lần đi ra ngoài tôi phải mang theo mọi thứ nên hơi bất tiện.	1
train_000689	tôi rất hài lòng về chất lượng dịch vụ của khách sạn eden plaza đà nẵng. vị trí ngay trung tâm thuận lợi cho việc tham quan các điểm du lịch nổi tiếng khác. phòng ở sạch sẽ, thoáng mát. bữa ăn sáng ngon và đa dạng.	1
train_000690	đợt vừa rồi gia đình tôi ở lại khách sạn eden plaza thấy rất hài lòng. nếu năm sau có dịp gia đình tôi lại ở đây. phòng ốc đẹp, vệ sinh và thông thoáng. nhân viên thì ai nấy đều thân thiện, nói chuyện vui vẻ và hướng đẫn tôi rất nhiệt tình. vị trí ở khu trung tâm cũng tiện đi lại.	1
train_000691	trong thời gian gia đình tôi lưu trú tại khách sạn eden plaza đà nẵng tôi cảm thấy rất hài lòng về tất cả mọi dịch vụ ở đây. phòng sạch sẽ, đầy đủ tiện nghi. đặc biệt là đội ngũ nhân viên phục vụ rất nhiệt tình và vui vẻ. đồ ăn rất ngon, phù hợp với khẩu vị của tất cả mọi người. mức độ hài lòng của tôi là 9 10.	1
train_000692	tôi chọn dịch vụ khách sạn này để có những ngày thư giãn ở thành phố du lịch nổi tiếng này. với tiện nghi khách sạn khang trang, rộng rãi tôi được cảm nhận trọn vẹn chuyến đi này. và thât sự cảm thấy hài lòng khi chọn khách sạn này làm điểm dừng chân.	1
train_000693	khách sạn đẹp với phòng rộng rãi, thoáng, nhân viên thân thiện, massage & spa tốt, hồ bơi sạch đẹp, tiền sảnh sang trọng. thiết kế đẹp. tôi sẽ trờ lại lần sau.	1
train_000694	3 ngày ở eden cảm giác rất dễ chịu, tôi chọn khách sạn vì có bể bơi đẹp, phòng rất rộng rãi, thơm tho đến trong dịp vắng khách nên cảm giác rất yên tĩnh. do ăn sáng hơi ít món để lựa chọn. nhưng nhìn chung vẫn ngon miệng. khách sạn hơi xa trung tâm. nhưng bạn có thể thuê xe máy với giá 100k ngày nên bạn có thể thoải mái đi lại nhìn chúng tôi rất hài lòng với kỳ nghỉ ở đây lần sau tôi sẽ quay lại.	1
train_000695	nhìn chung rất tốt, chắc chắn sẽ quay lại. giá cả hợp lý. nhà hàng làm đồ ăn ngon, hợp khẩu vị.	1
train_000696	vị trí của khách sạn hoàn hảo. trong vòng vài phút tôi đã đến hầu hết các điểm tham quan nổi tiếng đà nẵng. nhân viên khách sạn thân thiện nhiệt tình, phòng ốc luôn được dọn dẹp sạch sẽ và rông rãi, đầy đủ tiện nghi.	1
train_000697	khách sạn hoàn toàn đáp ứng được yêu cầu của chúng tôi. phòng rộng và sạch, đầy đủ tiện nghi, luôn được dọn dẹp sạch sẽ. nhân viên chu đáo, nhiệt tình. giá tôi đặt qua mytour được khuyến mãi nhiều nên cảm thấy rất hài lòng. tôi và gia đình đã có một kì nghỉ tuyệt vời.	1
train_000698	tôi chỉ đặt giúp cho khách. tuy nhiên theo phản hồi của khách tôi thấy dịch vụ ở đó tốt  thuận tiện cho khách đi lại. khách rất hài lòng và khen ngợi dịch vụ ở đó. tôi rất hài lòng về dịch vụ của mytour, các bạn rất nhanh chóng và nhiệt tình.	1
train_000699	phong cảnh ở đây rất đẹp, phòng rộng và thoải mái, đầy đủ tiện nghi. nhân viên phục vụ nhiệt tình chu đáo khiến tôi rất hài lòng. về dịch vụ của mytour.vn tôi thấy rất tốt, các bạn tư vấn nhiệt tình và dễ thương. tôi đã có một chuyến đi rất tuyệt.	1
train_000700	khách sạn gần trung tâm, rất tiện lợi cho việc đi lại và vui chơi, cách phục vụ của nhân viên ở đây rất dễ thương, nói chung là lý tưởng cho một chuyến đi du lịch.tôi sẽ còn quay lại khách sạn này nếu có dịp.	1
train_000701	một kỳ niệm đáng nhớ khi nghỉ tại khách sạn eden plaza đà nẵng. phong cách phục vụ, đồ ăn tuyệt vời, nhân viên thân thiện.	1
train_000702	khách sạn có vị trí tốt. nhưng hơi xa biển. phần thức ăn sáng chưa thật sự phong phú. gía cả phù hợp với chất lượng. tôi cảm thấy hài lòng với chất lượng dịch vụ ở đây.	1
train_000703	chúng tôi sử dụng dịch vụ mytour và rất hài lòng. các bạn nhanh chóng check thông tin và hỗ trợ cũng như hình thức thanh toán đa dạng.phòng nghỉ khách sạn sạch sẽ, đầy đủ tiện nghi. vị trí trung tâm, thuận tiện đi lại ăn uống. hài lòng về kỳ nghỉ.	1
train_000704	bể bơi xinh xắn. vị trí ngay trung tâm thánh phố, đi ra đâu cũng gần. sẽ trở lại nếu có dịp. phòng rộng rãi thoải mái. mình sẽ quay lại đây. trong dịp đi sắp tới.	1
train_000705	phòng nghỉ sạch sẽ, đầy đủ tiện nghi. nhân viên khách sạn chu đáo và nhiệt tình. kỳ nghỉ nhân ngày 8 3 , nên các chị em phụ nữ của đoàn rất hài lòng và vui vẻ. cảm ơn mytour và khách sạn đã hỗ trợ chúng tôi có kỳ nghỉ đáng nhớ ( đặc biệt là rất ấn tượng với bộ phận giặt là của ks).	1
train_000706	hài lòng khi ở tại đây. phòng không rộng lắm. nhưng sắp xếp đẹp thoải mái  phòng tắm nhìn vào phòng ngủ. hệ thống nước nóng hơi có vấn đề. bể bơi xinh xắn. vị trí ngay trung tâm thánh phố, đi ra đâu cũng gần. sẽ trở lại nếu có dịp.	1
train_000707	thủ tục nhận và trả phòng nhanh, nhân viên thân thiện và nhiệt tình, phòng rộng, sạch, phòng tắm tiện nghi, internet tốt. nói chung là hài lòng. thực đơn ăn sáng phong phú hơn nữa thì tốt hơn. thực đơn room service nên có sẵn. trong phòng.	1
train_000708	khach san co phong oc moi, nhan vien than thien va nhiet tinh. tuy nhien ho boi tre em tuy rat nho nhung rat sau  khoang 1m2. khach san nen co ban chi dan ngay phia truoc ho boi de moi nguoi luu y.khung canh khach san kha dep toi thay rat hai long ve khach san nay.	1
train_000709	đường xá đi vào khách sạn cũng thuận tiện. nhưng hơi vắng. hôm qua mình chek in muộn quá. nhưng khách sạn và nhân viên cũng khá nhiệt tình với mình. đồ ăn cũng hợp khẩu vị nữa.	1
train_000710	nhìn chung khách sạn mới, sạch đẹp và giá cả hợp lý. nhân viên dễ thương và nhiệt tình. tuy nhiên  ăn sáng đơn điệu  ít món. một điều khách sạn cần lưu tâm là màn sáo. trong phòng vệ sinh thiết kế không đủ dài để che kính trang trí. do vậy, nếu có người khác vào phòng thì người đang sử dụng phòng vệ sinh phải cảnh giác nên khá phiền phức. xin cám ơn dịch vụ rất tốt của mytour.vn.	1
train_000711	rất vui vì giá rẻ, lại được ở phòng đẹp, dịch vụ tốt, hồ bơi sạch, nhân viên thân thiện, gần trung tâm, gần sân bay, gần bãi biển, gần sông hàn, gần nơi vui chơi giải trí, hồ bơi sạch và rộng.	1
train_000712	vị trí khá gần sân bay và trung tâm. khách san đep. bể bơi sạch sẽ. tuy nhiên thực đơn ăn sáng không được phong phú và chất lượng trung bình.phòng standard không có cửa sổ.	1
train_000713	nhân viên phục vụ tận tình. bể bơi rộng rãi, bữa sáng chưa được ngon và không có nhiều lựa chọn lắm. gía tốt cho phòng rộng rãi, sẽ quay lại lần sau.	1
train_000714	phòng đẹp, tiện nghi, giường êm, internet tốc độ cao, nhận trả phòng nhanh, tốt cho đi công tác, ăn sáng hơi ít lựa chọn và lặp lại nếu ở dài ngày.	1
